Event #;Event Name;Creator;Commodity;Type;Items;Base Price;участники;победитель;Winners Price;Column1
37984;2023 RU MK1013 RFP ImmunoHub;Tatiana Mikhailina;MK1013;RFP;"подготовка контента: •	Материалы по международным конгрессам (International congresses) – со стороны компании будет предоставлен текст и слайды с иллюстрациями на английском языке, необходимо на его основании подготовить материал на русском языке в формате текст (200 слов макс) +иллюстрация (график, инфографика, слайд и др.); срок выполнения – в течение 3 раб дней после предоставления материалов.
•	Материалы по российским конгрессам (RU congresses) – сотрудник должен самостоятельно посетить конгресс (в онлайн формате), необходимо на основании представленных в рамках него материалов подготовить материал текст (200 слов макс) + иллюстрация (график, инфографика, слайд и др.); срок выполнения – 1 материал каждый 1 раб день после посещения конгресса.
•	Саммари по публикации (Hot articles) – со стороны компании будут предоставлена полнотекстовая публикация на английском языке, необходимо на ее основании подготовить материал на русском языке в формате текст (200 слов макс) +иллюстрация (график, инфографика, слайд и др.); срок выполнения – в течение 5 раб дней после предоставления публикации.
•	Заготовленный контент (Basic content) – со стороны компании будет предоставлен текст и слайды с иллюстрациями на русском языке (в случае видео – видео на англ. языке), необходимо на его основании подготовить материал на русском языке согласно контент плану; срок выполнения – cогласно указанному в файле (50 материалов за месяц).";10,000,000.00 RUB;"	ООО Теллер; ООО Палиндром; 	ООО КОФАКТОР; ООО Кемистри Креатив";ООО Теллер;980780 RUB;
32705;Lab. Reagents #16 (05.12.2022);Stanislav Ekhnev;RD2002;English auction;"Precast gels NuPAGE Invitrogen 4-12 % Bis-Tris, 1.0 mm; Membrane (blot): Invitrolon 0.45 μm PVDF, size (8,3×7,3) сm, Invitrolon™ PVDF/Filter Paper Sandwiches; 1.5 mL tubes conical tubes with snap caps, Protein LoBind Tubes; StainEase® Staining Trays; Sample buffer NuPAGE LDS 4× sample buffer; Running buffer NuPAGE MOPS SDS running buffer (20×); Transfer buffer NuPAGE 20× transfer buffer (20×); Albumin solution, 35 %, Fraction V; Molecular weight standard, molecular weights range from 4 to 250 kDa SeeBlue® Plus2 Pre-Stained Standard; Primary antibody, biotinylated anti-human VEGF R2 (KDR) antibody (polyclonal antibody, goat IgG); Alkaline phosphatase Stock solution, alkaline phosphatase-conjugated streptavidin; AP Conjugate Substrate Kit; Sodium azide; Glycerol, 99%; Precast gels Novex рН 3-10 IEF, 1.0 mm, 10 wells; 15 mL tubes conical tubes with snap caps; 50 mL tubes polypropylene conical tubes with screw caps; Anode buffer solution (50×) Novex® IEF Anode Buffer (50X); Cathode buffer solution (10×) Novex® IEF Cathode Buffer pH 3-10 (10X); IEF Marker pI 3-10 Novex® IEF Marker 3-10; Standard IEF Marker pI 7,4 95-100 % рI standard at рН 7.4: myoglobin, horse, lyophilized; Trichloracetic Acid 100% solution, 6.1 N (TCA); Sulfosalicylic Acid (SSA) 20 %; Sodium Phosphate Buffer рН 7.5 20 mM Sodium Phosphate Buffer рН 7.5 for HPCE; Sodium phosphate, dibasic, heptahydrate";;"AppScience; Альгимед, OOO; Лаверна ХХI век; ООО ""Фармреактив""; 	ООО Дельта Ориджин; Реаторг; ТД ""ГАЛА-ТРЕЙД""; 	Химмед";Альгимед, OOO;876,827.7173 RUB;
32485;Lab. Reagents #15 (24.11.2022);Stanislav Ekhnev;RD2002;English auction;"Milliflex-100, 100mL, 0.45μm, white gridded; MILLIFLEX OASIS® R2A low, nutrient media plates, Milliflex Oasis R2A media plates; MILLIFLEX OASIS® Tryptic Soy Media Plate, For detection of aerobic and anaerobic microflora; MILLIFLEX OASIS® Sabouraud Dextrose Media Plate, For detection of yeast and molds";25,000.00 USD;"AppScience; Альгимед, OOO; Лаверна ХХI век; ООО ""Фармреактив""; 	ООО Дельта Ориджин; Реаторг; ТД ""ГАЛА-ТРЕЙД""; 	Химмед";Химмед;122,930.40 RUB;
35383;Реконструкция чистых помещений комнаты отбора проб склада СЛ/ WH clean rooms refurbishment;Sergey Levin;MC1027;RFP;Реконструкция чистых помещений комнаты отбора проб склада СЛ;150,000.00 EUR;"Конвент, ООО; ООО «Тайтега АГ»; ООО «КЛИМАОПРЕМА»; Эталонфарм, ООО; Клин Системс, ООО";ООО «Тайтега АГ»;18,855,960.00 RUB;
31678;Lab. Reagents #13 (25.10.2022);Stanislav Ekhnev;RD2002;English auction;"фосфатно-солевой буферный раствор 10 × C без кальция и магния; полисорбат-20 (твин-20); хромогенный субстрат: раствор ТМБ однокомпонентный, готовый к использованию; карбонатно-бикарбонатный буфер, в капсулах; Диэтаноламин";25,000.00 USD;"AppScience; Альгимед, OOO; Лаверна ХХI век; ООО ""Фармреактив""; 	ООО Дельта Ориджин; Реаторг; ТД ""ГАЛА-ТРЕЙД""; 	Химмед";AppScience;357,360.00 RUB;
31429;Lab. Reagents #11 (12.10.2022);Stanislav Ekhnev;RD2002;English auction;"метиловый оранжевый; натрия ЭДТА 99 %; меди сульфата пентагидрат; раствор алюминия 1 мг/мл";30,000.00 USD;"AppScience; Альгимед, OOO; Лаверна ХХI век; ООО ""Фармреактив""; 	ООО Дельта Ориджин; Реаторг; ТД ""ГАЛА-ТРЕЙД""; 	Химмед";"Химмед; Лаверна ХХI век";11,479.00 RUB;
31336;Lab. Reagents #10 (07.10.2022);Stanislav Ekhnev;RD2002;English auction;"Ezetimibe standard, CAS 163222-33-1; Desfluoro Ezetimibe CAS 302781-98-2; Rosuvastatin calcium SCR CAS 147098-20-2";30,000.00 USD;"AppScience; Альгимед, OOO; Лаверна ХХI век; ООО ""Фармреактив""; 	ООО Дельта Ориджин; Реаторг; ТД ""ГАЛА-ТРЕЙД""; 	Химмед";AppScience;106,128.00 RUB;
31153;Lab. Reagents #9 (29.09.2022);Stanislav Ekhnev;RD2002;English auction;"Раствор анолита Hydranal Coulomat AG-Oven; Стандартный образец воды Hydranal 5% Water Standard KF-Oven; Стандартный образец бычьего сывороточного альбумина (БСА), Bovine Serum Albumin Standard; Вторичные козлиные поликлональные антитела, специфичные к мышиным IgG, конъюгированные со щелочной фосфатазой; Фосфатно-буферный солевой раствор, PBS, рН 7,2; 5% раствор бычьего сывороточного альбумина; Субстрат для окрашивания со щелочной фосфатазой, BCIP/NBT Solution; Десятикратный отмывающий буфер, 10X (ELISA) Plate Wash Buffer; 0,9% раствор натрия хлорида; Натрия дигидрофосфата моногидрат; Динатрия гидрофосфата гептагидрат; L-метионин; 96-луночные планшеты вместимостью 360 мкл Costar EIA/RIA с плоским дном из стирола; Система фильтрации вместимостью 250 мл с полиэфирсульфоновой мембраной (PES) с диаметром пор 0,22 мкм; Хроматографическая колонка Acquity UPLC BEH300 C18, размер 2,1 × 100 мм, заполненная сорбентом с размером частиц 1,7 мкм и диаметром пор 300Å";30,000.00 USD;"AppScience; Альгимед, OOO; Лаверна ХХI век; ООО ""Фармреактив""; 	ООО Дельта Ориджин; Реаторг; ТД ""ГАЛА-ТРЕЙД""; 	Химмед";Альгимед, OOO;101,426.214 RUB;
31111;Lab. Reagents #8 (28.09.2022);Stanislav Ekhnev;RD2002;RFP;"фосфатный буферный раствор 10 х С (ФБР 10 х С) рН = 7,2 без кальция и магния; ";30,000.00 USD;"AppScience; Альгимед, OOO; Лаверна ХХI век; ООО ""Фармреактив""; 	ООО Дельта Ориджин; Реаторг; ТД ""ГАЛА-ТРЕЙД""; 	Химмед";Альгимед, OOO;12,810.8344 RUB;
30985;Lab. Reagents #7 (26.09.2022);Stanislav Ekhnev;RD2002;RFP;Standard solution of 5 anions (sulfate ion 150 mg/L, fluoride ion, 20 mg/L, chloride ion 30 mg/L, phosphate ion 150 mg/L, nitrate ion 100 mg/L);30,000.00 USD;"AppScience; Альгимед, OOO; Лаверна ХХI век; ООО ""Фармреактив""; 	ООО Дельта Ориджин; Реаторг; ТД ""ГАЛА-ТРЕЙД""; 	Химмед";Химмед;24,228.2931 RUB;
30891;Lab. Reagents #7 (21.09.2022);Stanislav Ekhnev;RD2002;RFP;"Standard solution of 6 anions (sulfate ion 150 mg/L, fluoride ion, 20 mg/L, chloride ion 30 mg/L, phosphate ion 150 mg/L, oxalate ion 250 mg/L, nitrate ion 100 mg/L); Standard solution of 5 anions (sulfate ion 150 mg/L, fluoride ion, 20 mg/L, chloride ion 30 mg/L, phosphate ion 150 mg/L, nitrate ion 100 mg/L)";110,000.00 USD;"AppScience; Альгимед, OOO; Лаверна ХХI век; ООО ""Фармреактив""; 	ООО Дельта Ориджин; Реаторг; ТД ""ГАЛА-ТРЕЙД""; 	Химмед";AppScience;39,860.00 RUB;
30886;Lab. Reagents #5 (05.09.2022);Stanislav Ekhnev;RD2002;RFP;Enoxaparin Sodium for Bioassays;110,000.00 USD;"AppScience; Альгимед, OOO; Лаверна ХХI век; ООО ""Фармреактив""; 	ООО Дельта Ориджин; Реаторг; ТД ""ГАЛА-ТРЕЙД""; 	Химмед";Химмед;5,549,928.1619 RUB;
14614;Услуги по обслуживанию зданий, сооружений_Санофи-Авентис Восток Орел/ Building and construction maintenance_Sanofi Orel site ;Sergey Levin;MC2002;RFP;Услуги по обслуживанию зданий, сооружений;7,000,000.00 RUB;"ООО""Мастерфайбр Центр""; ООО «ДАИНЖ»; ЗАО «Европромстрой»; ООО ""Стройэнергомонтаж""; ООО «ПК Габарит +» ";ЗАО «Европромстрой»;6780000 RUB;
30785;Lab. Reagents #6 (15.09.2022);Stanislav Ekhnev;RD2002;RFP;Enoxaparin Sodium for Bioassays (COLD SHIPMENT REQUIRED) Reference standard;110,000.00 USD;"AppScience; Альгимед, OOO; Лаверна ХХI век; ООО ""Фармреактив""; 	ООО Дельта Ориджин; Реаторг; ТД ""ГАЛА-ТРЕЙД""; 	Химмед";AppScience;496,200.00 RUB;
33523;RU_Auction_Car Insurance_2023_2024;Irina Bakhareva;CS6008;English auction;"государственное обязательное страхование для одного авто; Базовая ставка ОСАГО, RUB; Страхование от несчастных случаев (4 места по 10000 USD), RUB; Тариф по КАСКО, %";50,000,000.00 RUB;"Альфа Страхование; ВСК Страховой Дом; Ингосстрах; Сбер Страхование";Ингосстрах;3,948.87 RUB;
30887;RU_RFP_PPE_Orel_ 2022_2025;Irina Bakhareva;CS5041;RFP;"Патрон 3М 6059; Брюки СПЕЦ ут цв. сер-крас-чер. тк. Нортси (96-100/182-188); Обувь мед. женская Oxypas SANDY WHT р.37; Патрон 3M ABE1 6057; Ботинки ""РАНГ Полярис"", цв черн, композит 200 Дж, резина нат.мех, Р45; Куртка ЭДВАНС сер/т.сер/чер Кур 687 (96-100/194-200); Футболка Футболка светло-серая (L); Куртка СПЕЦ ут цв. сер-крас-чер. тк. Нортси (96-100/170-176); Каскетка JSP ХАРДКАП А1+; Комбинезон DuPont ТАЙВЕК CHF5 цв.бел. (S); Комбинезон DuPont ТАЙВЕК CHF5 цв.бел. (M); Костюм ЛЕДИ СПЕЦ цв.сер-крас. тк. смесовая (88-92/170-176); Сабо ЭВА медицинские STEP. Размер 38; Сабо ЭВА медицинские STEP. Размер 36; Сабо ЭВА медицинские STEP. Размер 37; Сабо ЭВА медицинские STEP. Размер 39; Сабо ЭВА медицинские STEP. Размер 40; Сабо ЭВА медицинские STEP. Размер 40; Сабо ЭВА медицинские STEP. Размер 41; Сабо ЭВА медицинские STEP. Размер 42; Сабо ЭВА медицинские STEP. Размер 43; Сабо ЭВА медицинские STEP. Размер 44; Сабо ЭВА медицинские STEP. Размер 45; Сабо ЭВА медицинские STEP. Размер 46; Перчатки Cerva Бантинг Эволюшн, полиэфир, бел, р-р 10; Перчатки Cerva Бантинг Эволюшн, полиэфир, бел, р-р 9; Перчаки Cerva Бантинг Эволюшн, полиэфир, р-р 7; Перчаки Cerva Бантинг Эволюшн, полиэфир, р-р 8; Перчаки Cerva Бантинг Эволюшн, нейлон, цвет черный, частичное ПУ, р-р 10; Перчаки Cerva Бантинг Эволюшн, нейлон, цвет черный, частичное ПУ, р-р 9; Перчаки Cerva Бантинг Эволюшн, нейлон, цвет белый, частичное ПУ, р-р 10; Наушники противошумные 3M Peltor Optime H510P3E405GU крепление на каску; Каска 3М PELTOR G3000  OR цв. оранжевый, пазы для наушников  и щитков; Щиток 3М Peltor V4H, прозрачная линза; Беруши HONEYWELL МАКС 1013046 (200 пар/упак); Брюки ЭДВАНС, сер/т.сер/чер Брю 616 (88-92/194-200); Полумаска фильтрующая Spirotek VS 2200V; Комплект PLUM для чрезвычайных ситуаций; Ботинки ""РАНГ Полярис""; Перчатки ХАКАСЫ ут цв т. сер-мел мт.спилок Тинсулейт покр. частичное (М); Перчатки ХАКАСЫ ут цв т. сер-мел мт.спилок Тинсулейт покр. частичное (L); Перчатки SpiderGrip, бел, р-р 8; Перчатки SpiderGrip, бел, р-р 9; Перчатки SpiderGrip, бел, р-р 10; Брюки CERVA ОЛЬЗА ГОСТ цв. сер. тк. смесовая (96-100/170-176); Брюки CERVA ОЛЬЗА (104-108/170-176); Перчатки ""Хакасы""; Куртка СПЕЦ ут цв. сер-крас-чер. тк. Нортси (96-100/182-188); Куртка СПЕЦ ут цв. сер-крас-чер. тк. Нортси (104-108/182-188); Брюки СПЕЦ ут цв. сер-крас-чер. тк. Нортси (104-108/170-176); Перчатки Анселл Хайфлекс; Ботинки высокие Трейл ВИНТЕР (Р) ут цв. чер. сталь 200Дж ПУ/ТПУ нат. мех (41); Ботинки высокие Трейл ВИНТЕР (Р) ут цв. чер. сталь 200Дж ПУ/ТПУ нат. мех (42); Ботинки высокие Трейл ВИНТЕР (Р) ут цв. чер. сталь 200Дж ПУ/ТПУ нат. мех (43); Ботинки высокие Трейл ВИНТЕР (Р) ут цв. чер. сталь 200Дж ПУ/ТПУ нат. мех (44); Шапка СКЕЙТЕР-3 ут.черная; Брюки СПЕЦ ут цв. сер-крас-чер. тк. Нортси (96-100/170-176) ; Рубашка ПОЛО-К, цв. вас., р-р М";10,000,000.00 RUB;"Восток-Спецодежда ; Восток-Сервис; Меркурий; ТД ТРАКТ; Ай Би Си Нанотекс; Альфа-Лаб; Лаборатория Технологической Одежды; Дарина ; Тракт; Дарина";Восток-Спецодежда;;
25029;RU_RFP_DD tool 2022_2024;Irina Bakhareva;CS5040;RFP;"Пожертвования; Поставщики; Аутсорсинг; Таможня, транспорт; Исследование рынка; Клинические исследования; Услуги по командировкам; Высокорискованные; Низкорискованные; Спонсорство; Стоимость установки; Лицензионный сбор; Автоматизированные проверки; Соблюдение Закона о Персональных Данных";10,000,000.00 RUB;"Directum; Accenture; APEX; COSA; Delloite; Dow Jones; KPMG; Lexis-Nexis; PwC; Refinitiv; Risk Advisory; Steele Diligent; Thompson Reuters; БДО Юникон АО; Интелинфо; Urus consulting";Интелинфо;8700200 RUB;
38247;RU_RFP_Record Management;Irina Bakhareva;CS5035;RFP;"Плата за услуги хранения, короб; Плата за услуги хранения кассет; Хранение массива данных в системе электронного архива, Гб; Пользование электронным архивом, пользователь; Он-лайн система учёта и заказа документов, пользователь; Стандартный архивный короб; Крышка к стандартному коробу; Файловый короб; Штрих-коды для короба, фалового короба, кассеты; Составление описания (короб, файл); Систематизация носителей информации; Упаковка / переупаковка документов за короб ; Упаковка/переупаковка Носителей информации Поклажедателя в файловые короба Поставщика (включена стоимость упаковки в короба при заказе этой услуги); Перевод описания в электронный вид ; Экспертиза ценности, определение сроков хранения документов, за дело; Архивный пеперпле, за дело; Сбор пустого Стандартного короба Поставщика с крышкой/Файловой коробки Поставщика при доставке силами Курьерской службы Поставщика (стоимость данной услуги включается в стоимость услуги по Упаковке/переупаковке Носителей информации в случае одновременного заказа этих двух услуг); Обработка новых носителей информации; Регистрация при изъятии (временное или постоянное), за короб; Регистрация при изъятии Носителей информации (временное или постоянное), за файл; Срочное изъятие Носителей информации в течение 1 часа (выдача курьеру Поклажедателя); Перерегистрация Носителей информации при возврате их в Хранилища, за короб / файл; Поиск документа, за документ ; Копирование документа, за страницу; Подготовка к потоковому сканированию, за страницу; Потоковое сканирование, за страницу; Сканирование документов, за страницу ; Аренда комнаты для работы с документами, за час ; Постоянное изъятие информации, за короб ; Постоянное изъятие информации, за файл ; Безвозвратное изъятие с удалением информации из системы учёта; Обыкновенная доставка вывоз на следующий рабочий день, за поездку; Обыкновенная доставка вывоз на следующий рабочий день, за поездку до 30 км от города; Срочная доставка или вывоз в течение половины рабочего дня, за поездку; Обыкновенная транспортировка в течение половины рабочего дня, за короб / файл / кассету; Срочная транспортировка на следующий рабочий день, за короб / файл / кассету ; Картонный контейнер для конфиденциального уничтожения, за контейнер; Аренда металлического контейнера 240 л, за контейнер; Конфиденциальное уничтожение информации, за кг; Видеозапись процесса уничтожения документов, за запись ";5,600,000.00 RUB;"ООО ОСГ Рекордз Менеджмент Центр; ОРБ; Делис Альянс; ТЭЛОС Архив; Архив-Сервис; Инфолоджистикс; Архивариус";ООО ОСГ Рекордз Менеджмент Центр;5780300 RUB;
32096;RU_Auction_iFM_MSK_2023_2025;Irina Bakhareva;CS5030;English auction;"Уборка офисных и производственных помещений; Техническая эксплуатация и обслуживание Зданий; Уход за растениями и декорациями ; Организация питания; Услуги ресепшн";20,000,000.00 RUB;"iFCM; SOL; FSR; ОМС";iFCM;55,854,611.00 RUB;
45054;Строительно-монтажные работы Санофи Восток/ Building maintenance Sanofi Vostok;Sergey Levin;MC2014;RFP;Строительно-монтажные работы на заводе в г. Орёл;300,000.00 EUR;"ООО""Мастерфайбр Центр""; ООО ""Перспектива""; ЛикоСвет, ООО; РИКС, ООО; Стройотряд 57, ООО";"ООО ""ЛикоСвет""";111,380.00 RUB;
23164;Тендер на поставку угля активного древесного/Activated carbon supply;Sergey Levin;MC3009;English auction;Уголь активный древесный дробленый БАУ-А (ГОСТ6217-74);254,400.00 RUB;"ТЕХВОДПРОЕКТ; ООО ТД ""Уралхимсорб""; ""НПО ""ПОВОЛЖСКИЙ ЗАВОД СОРБЕНТОВ ""ТАТСОРБ""";"ООО ТД ""Уралхимсорб""";254000 RUB;
